{
  "amendment_id": "s4_8_recovery_amendment_02",
  "artifact_count": 374,
  "artifact_inventory_sha256": "307401342ef9bcbed66226aff230b7232f62af567cd77ce54a9df6d672b8dc71",
  "artifacts": [
    {
      "byte_size": 1389,
      "path": "dataset/S4.4/amendments/s4_4_data_expansion_amendment_04/attempts/s48r02_preholdout_001_silence_beginning/s48r02_preholdout_001_silence_beginning__attempt_01/official_attempt_record.json",
      "role": "retained_attempt_official_attempt_record.json",
      "sha256": "b945020a1a085431d09000cec27889e46b60515ea0ff6275684820491242be3d"
    },
    {
      "byte_size": 1042,
      "path": "dataset/S4.4/amendments/s4_4_data_expansion_amendment_04/attempts/s48r02_preholdout_001_silence_beginning/s48r02_preholdout_001_silence_beginning__attempt_01/official_take_authorization.json",
      "role": "retained_attempt_official_take_authorization.json",
      "sha256": "ad0e68ee99f36d59ecf6a31536b29475a2cbc5e10047278a8bdf7f08e6e4eedd"
    },
    {
      "byte_size": 1284,
      "path": "dataset/S4.4/amendments/s4_4_data_expansion_amendment_04/attempts/s48r02_preholdout_001_silence_beginning/s48r02_preholdout_001_silence_beginning__attempt_01/pi_producer_status.json",
      "role": "retained_attempt_pi_producer_status.json",
      "sha256": "3734bb66569110606c9fb8406a20500055cf7f02af6d6c25c0782a7d1696f072"
    },
    {
      "byte_size": 6327,
      "path": "dataset/S4.4/amendments/s4_4_data_expansion_amendment_04/attempts/s48r02_preholdout_001_silence_beginning/s48r02_preholdout_001_silence_beginning__attempt_01/process_journal.jsonl",
      "role": "retained_attempt_process_journal.jsonl",
      "sha256": "beab5c2b4f353795b5bdd531e72dff3539a3cb95498ad43f4b80d985c1ebc6ea"
    },
    {
      "byte_size": 2880044,
      "path": "dataset/S4.4/amendments/s4_4_data_expansion_amendment_04/attempts/s48r02_preholdout_001_silence_beginning/s48r02_preholdout_001_silence_beginning__attempt_01/respeaker_audio.wav",
      "role": "retained_attempt_respeaker_audio.wav",
      "sha256": "2bedf4ecc720ce493f33dda82951a5b0c97faf39eb74813061df1c9207782ff4"
    },
    {
      "byte_size": 1023,
      "path": "dataset/S4.4/amendments/s4_4_data_expansion_amendment_04/attempts/s48r02_preholdout_001_silence_beginning/s48r02_preholdout_001_silence_beginning__attempt_01/technical_candidate_seal.json",
      "role": "retained_attempt_technical_candidate_seal.json",
      "sha256": "0c604b7c917ded8d37050821988e7ee6c9bd7a1caab0df4afb529d257dbbe7c0"
    },
    {
      "byte_size": 262,
      "path": "dataset/S4.4/amendments/s4_4_data_expansion_amendment_04/attempts/s48r02_preholdout_001_silence_beginning/s48r02_preholdout_001_silence_beginning__attempt_01/technical_clearance_consumed.json",
      "role": "retained_attempt_technical_clearance_consumed.json",
      "sha256": "92f8565bd00e4d08da224d791806af6c4c83a92ffdeb8f16e61bf0aafce4ee2a"
    },
    {
      "byte_size": 2039,
      "path": "dataset/S4.4/amendments/s4_4_data_expansion_amendment_04/attempts/s48r02_preholdout_001_silence_beginning/s48r02_preholdout_001_silence_beginning__attempt_01/technical_gate_report.json",
      "role": "retained_attempt_technical_gate_report.json",
      "sha256": "031dea6ef2c0c971bf565602e160525743869067c056cacea2eab453463da333"
    },
    {
      "byte_size": 1386,
      "path": "dataset/S4.4/amendments/s4_4_data_expansion_amendment_04/attempts/s48r02_preholdout_002_direction_000_r1/s48r02_preholdout_002_direction_000_r1__attempt_01/official_attempt_record.json",
      "role": "retained_attempt_official_attempt_record.json",
      "sha256": "5168d28d8e04583ce18008b7a17e980fd4b8ed29ee4abd5de6f4138766d74d77"
    },
    {
      "byte_size": 1040,
      "path": "dataset/S4.4/amendments/s4_4_data_expansion_amendment_04/attempts/s48r02_preholdout_002_direction_000_r1/s48r02_preholdout_002_direction_000_r1__attempt_01/official_take_authorization.json",
      "role": "retained_attempt_official_take_authorization.json",
      "sha256": "d37c9e448269c7e2da7085857f830564ae22bb0c93794e49fdf920923d4690c5"
    },
    {
      "byte_size": 1284,
      "path": "dataset/S4.4/amendments/s4_4_data_expansion_amendment_04/attempts/s48r02_preholdout_002_direction_000_r1/s48r02_preholdout_002_direction_000_r1__attempt_01/pi_producer_status.json",
      "role": "retained_attempt_pi_producer_status.json",
      "sha256": "f0469623be866ece9ccff265810a94828d376833514bf02db41769453639e851"
    },
    {
      "byte_size": 7414,
      "path": "dataset/S4.4/amendments/s4_4_data_expansion_amendment_04/attempts/s48r02_preholdout_002_direction_000_r1/s48r02_preholdout_002_direction_000_r1__attempt_01/process_journal.jsonl",
      "role": "retained_attempt_process_journal.jsonl",
      "sha256": "216599b135b8a05564ced9bff51dc06f17349693cce8d71440bab08b2074b22a"
    },
    {
      "byte_size": 3840044,
      "path": "dataset/S4.4/amendments/s4_4_data_expansion_amendment_04/attempts/s48r02_preholdout_002_direction_000_r1/s48r02_preholdout_002_direction_000_r1__attempt_01/respeaker_audio.wav",
      "role": "retained_attempt_respeaker_audio.wav",
      "sha256": "a15233b3d3478e45346ed4912aa40dde19eb691549cb25372f6f5c41b6a888d2"
    },
    {
      "byte_size": 964,
      "path": "dataset/S4.4/amendments/s4_4_data_expansion_amendment_04/attempts/s48r02_preholdout_002_direction_000_r1/s48r02_preholdout_002_direction_000_r1__attempt_01/technical_candidate_seal.json",
      "role": "retained_attempt_technical_candidate_seal.json",
      "sha256": "6b180c1a0948e1f942f3e99bdfa04d9eea0224452efdc285d5afd08dcdf12205"
    },
    {
      "byte_size": 249,
      "path": "dataset/S4.4/amendments/s4_4_data_expansion_amendment_04/attempts/s48r02_preholdout_002_direction_000_r1/s48r02_preholdout_002_direction_000_r1__attempt_01/technical_clearance_consumed.json",
      "role": "retained_attempt_technical_clearance_consumed.json",
      "sha256": "9819dd629469435351ea9e9b001af76c74ffec9b91473a057d2b7904b3dcbabd"
    },
    {
      "byte_size": 271983,
      "path": "dataset/S4.4/amendments/s4_4_data_expansion_amendment_04/attempts/s48r02_preholdout_002_direction_000_r1/s48r02_preholdout_002_direction_000_r1__attempt_01/technical_gate_report.json",
      "role": "retained_attempt_technical_gate_report.json",
      "sha256": "9f991eba1fdf449c135d8ae1b20d6bca0f8fbf51271e84cde8eec8831e3ddbcd"
    },
    {
      "byte_size": 1281,
      "path": "dataset/S4.4/amendments/s4_4_data_expansion_amendment_04/attempts/s48r02_preholdout_002_direction_000_r1/s48r02_preholdout_002_direction_000_r1__attempt_01/technical_precollection_manifest.json",
      "role": "retained_attempt_technical_precollection_manifest.json",
      "sha256": "1ac859352fc99df2adfb1d0c5f4faeb34c6b0633691b7c33593f4edc762f7b74"
    },
    {
      "byte_size": 1386,
      "path": "dataset/S4.4/amendments/s4_4_data_expansion_amendment_04/attempts/s48r02_preholdout_003_direction_000_r2/s48r02_preholdout_003_direction_000_r2__attempt_01/official_attempt_record.json",
      "role": "retained_attempt_official_attempt_record.json",
      "sha256": "f40aaeae927d91f37d8db356a86cb1f40b2247ba47e789c797724e35e5d93bf1"
    },
    {
      "byte_size": 1040,
      "path": "dataset/S4.4/amendments/s4_4_data_expansion_amendment_04/attempts/s48r02_preholdout_003_direction_000_r2/s48r02_preholdout_003_direction_000_r2__attempt_01/official_take_authorization.json",
      "role": "retained_attempt_official_take_authorization.json",
      "sha256": "e3b9d35447acf9c72441a601380665486579e5c086b1df2397b0fffa5e032abc"
    },
    {
      "byte_size": 1284,
      "path": "dataset/S4.4/amendments/s4_4_data_expansion_amendment_04/attempts/s48r02_preholdout_003_direction_000_r2/s48r02_preholdout_003_direction_000_r2__attempt_01/pi_producer_status.json",
      "role": "retained_attempt_pi_producer_status.json",
      "sha256": "e77301e423346b849fe2c4a4956437265cbceac684f108a3377705a03e30d0e5"
    },
    {
      "byte_size": 7414,
      "path": "dataset/S4.4/amendments/s4_4_data_expansion_amendment_04/attempts/s48r02_preholdout_003_direction_000_r2/s48r02_preholdout_003_direction_000_r2__attempt_01/process_journal.jsonl",
      "role": "retained_attempt_process_journal.jsonl",
      "sha256": "1b492a2e0a5a87acc4a0a65ae3efe4a85b059c68a1fa532811a69e26b6888524"
    },
    {
      "byte_size": 3840044,
      "path": "dataset/S4.4/amendments/s4_4_data_expansion_amendment_04/attempts/s48r02_preholdout_003_direction_000_r2/s48r02_preholdout_003_direction_000_r2__attempt_01/respeaker_audio.wav",
      "role": "retained_attempt_respeaker_audio.wav",
      "sha256": "66cafc7fca9e4d99473b030c8ba56b650436b2cedf6d26fbd7f6c4b4cb7d3ea5"
    },
    {
      "byte_size": 964,
      "path": "dataset/S4.4/amendments/s4_4_data_expansion_amendment_04/attempts/s48r02_preholdout_003_direction_000_r2/s48r02_preholdout_003_direction_000_r2__attempt_01/technical_candidate_seal.json",
      "role": "retained_attempt_technical_candidate_seal.json",
      "sha256": "9ab1b536fb0fdeffdb7bb23ba417e6465232652e68121fbf38aed8f2baff222b"
    },
    {
      "byte_size": 249,
      "path": "dataset/S4.4/amendments/s4_4_data_expansion_amendment_04/attempts/s48r02_preholdout_003_direction_000_r2/s48r02_preholdout_003_direction_000_r2__attempt_01/technical_clearance_consumed.json",
      "role": "retained_attempt_technical_clearance_consumed.json",
      "sha256": "73de2cd8c34ddff89713d1217ed94a4829b86d1bd5f1ee279e6e04bff486d942"
    },
    {
      "byte_size": 271783,
      "path": "dataset/S4.4/amendments/s4_4_data_expansion_amendment_04/attempts/s48r02_preholdout_003_direction_000_r2/s48r02_preholdout_003_direction_000_r2__attempt_01/technical_gate_report.json",
      "role": "retained_attempt_technical_gate_report.json",
      "sha256": "883099c1887f7e4e7ce820ddce1766fa676ee0dc5c96ac7056c3ac33a0083bc3"
    },
    {
      "byte_size": 1281,